{
  "schema_version": 1,
  "scope_id": "yunmom-cn-public-store-v1",
  "scope_version": "0.1.0",
  "jurisdiction": "CN_MAINLAND",
  "audience": "ADULT_18_PLUS_PREGNANCY",
  "release_status": "RELEASE_NOT_APPROVED",
  "platform_contract": "ANDROID_FIRST_IOS_ANDROID_SEMANTIC_PARITY",
  "updated_at": "2026-08-11T18:44:00+08:00",
  "scope_statuses": [
    "required_enabled",
    "required_present_disabled",
    "future_explicitly_excluded"
  ],
  "delivery_states": ["planned", "scaffolded_disabled", "implemented", "verified", "excluded"],
  "registers": [
    {
      "id": "R1_PRODUCT_AND_SKILLS",
      "title": "Phase 1–6 产品能力与 30 个 Skill",
      "default_owner_roles": ["PO", "TECH", "QA"],
      "items": [
        {"id":"FEAT-P1-001","kind":"feature","phase":"P1","name":"YunMom Character Bible","scope_status":"required_enabled","delivery_state":"planned","contract_refs":["BND-004","SCP-001"],"gates":["VISUAL_G1","ETHICS_REVIEW"]},
        {"id":"FEAT-P1-002","kind":"feature","phase":"P1","name":"Baby Stage Bible","scope_status":"required_present_disabled","delivery_state":"scaffolded_disabled","contract_refs":["BND-004","MED-005","SCP-001"],"gates":["MD_STAGE_EVIDENCE","VISUAL_G3"]},
        {"id":"FEAT-P1-003","kind":"feature","phase":"P1","name":"Onboarding 与成年用户确认","scope_status":"required_enabled","delivery_state":"planned","contract_refs":["USR-001","SCP-001"],"gates":["LEGAL_COPY"]},
        {"id":"FEAT-P1-004","kind":"feature","phase":"P1","name":"HOME Living World 与 Pregnancy Time","scope_status":"required_present_disabled","delivery_state":"planned","contract_refs":["BND-004","A11Y-001","SCP-001"],"gates":["VISUAL_G1","VISUAL_G4_TOKENS"]},
        {"id":"FEAT-P1-005","kind":"feature","phase":"P1","name":"Silent Day 与低压力呈现","scope_status":"required_present_disabled","delivery_state":"planned","contract_refs":["A11Y-003","TOK-002","SCP-001"],"gates":["VISUAL_G4_TOKENS","ETHICS_REVIEW"]},
        {"id":"FEAT-P1-006","kind":"feature","phase":"P1","name":"Ambient、天气与星星","scope_status":"required_present_disabled","delivery_state":"planned","contract_refs":["TOK-001","TOK-002","SCP-001"],"gates":["VISUAL_G4_TOKENS","LOCATION_CONSENT"]},
        {"id":"FEAT-P1-007","kind":"feature","phase":"P1","name":"Care Bento 与三方向等价导航","scope_status":"required_present_disabled","delivery_state":"planned","contract_refs":["A11Y-002","SCP-001"],"gates":["VISUAL_G4_TOKENS","A11Y_P0"]},
        {"id":"FEAT-P1-008","kind":"feature","phase":"P1","name":"AI Overlay、长按语音与 Camera Drag","scope_status":"required_present_disabled","delivery_state":"planned","contract_refs":["CONSENT-002","FILE-001","SCP-001"],"gates":["PROVIDER_ALLOWLIST","PER_SEND_CONSENT"]},
        {"id":"FEAT-P1-009","kind":"feature","phase":"P1","name":"声音、Haptics 与 Reduce Motion","scope_status":"required_present_disabled","delivery_state":"planned","contract_refs":["A11Y-003","TOK-002","SCP-001"],"gates":["A11Y_P0","VISUAL_G4_TOKENS"]},

        {"id":"FEAT-P2-001","kind":"feature","phase":"P2","name":"Pregnancy Event Store 唯一事实源","scope_status":"required_enabled","delivery_state":"planned","contract_refs":["EVT-001","EVT-002","SCH-001"]},
        {"id":"FEAT-P2-002","kind":"feature","phase":"P2","name":"Universal Field 与 Provenance","scope_status":"required_enabled","delivery_state":"planned","contract_refs":["FLD-001","FLD-002"]},
        {"id":"FEAT-P2-003","kind":"feature","phase":"P2","name":"Skill Harness 与 Minimal Context","scope_status":"required_present_disabled","delivery_state":"planned","contract_refs":["CTX-001","CONSENT-002"],"gates":["PROVIDER_ALLOWLIST"]},
        {"id":"FEAT-P2-004","kind":"feature","phase":"P2","name":"Typed Command、原子 Event 集与幂等","scope_status":"required_enabled","delivery_state":"planned","contract_refs":["CMD-001","IDEMP-001"]},
        {"id":"FEAT-P2-005","kind":"feature","phase":"P2","name":"Action Receipt、Correct、Supersede、Revert 与 Undo","scope_status":"required_enabled","delivery_state":"planned","contract_refs":["EVT-003","RCT-001"]},
        {"id":"FEAT-P2-006","kind":"feature","phase":"P2","name":"Conflict Set 与 Resolution Event","scope_status":"required_enabled","delivery_state":"planned","contract_refs":["CFL-001"]},

        {"id":"FEAT-P3-001","kind":"feature","phase":"P3","name":"Profile、Episode、1..N BabySubject 与生命周期","scope_status":"required_enabled","delivery_state":"planned","contract_refs":["EPI-001","EPI-002","EPI-003","EPI-004"]},
        {"id":"FEAT-P3-002","kind":"feature","phase":"P3","name":"产检、医院、Planner、Timeline 与 Calendar","scope_status":"required_enabled","delivery_state":"planned","contract_refs":["MED-001","MED-005","SCP-001"]},
        {"id":"FEAT-P3-003","kind":"feature","phase":"P3","name":"报告原件、OCR 提取与事实/解释/医生判断分层","scope_status":"required_present_disabled","delivery_state":"planned","contract_refs":["MED-004","MED-006","FILE-001"],"gates":["MD_REPORT_RULES","PROVIDER_ALLOWLIST"]},
        {"id":"FEAT-P3-004","kind":"feature","phase":"P3","name":"本地确定性 Medical Safety Signposting","scope_status":"required_present_disabled","delivery_state":"planned","contract_refs":["MED-001","MED-002","MED-003","SAFEOPS-001"],"gates":["MD_SIGNED_RULE_PACK","CLINICAL_GOLDEN"]},

        {"id":"FEAT-P4-001","kind":"feature","phase":"P4","name":"知识与经批准本地 RAG","scope_status":"required_present_disabled","delivery_state":"planned","contract_refs":["PROV-001","TEL-001","SCP-001"],"gates":["CONTENT_RIGHTS","MD_OR_LEGAL_REVIEW"]},
        {"id":"FEAT-P4-002","kind":"feature","phase":"P4","name":"心情与日记","scope_status":"required_enabled","delivery_state":"planned","contract_refs":["MED-008","FAM-002","FAM-003"]},
        {"id":"FEAT-P4-003","kind":"feature","phase":"P4","name":"饮食、运动与体重记录","scope_status":"required_enabled","delivery_state":"planned","contract_refs":["FLD-001","MED-004"]},
        {"id":"FEAT-P4-004","kind":"feature","phase":"P4","name":"药物记录、提醒与保守安全提示","scope_status":"required_present_disabled","delivery_state":"planned","contract_refs":["MED-004","MED-007"],"gates":["MD_MEDICATION_RULES"]},
        {"id":"FEAT-P4-005","kind":"feature","phase":"P4","name":"胎动、宫缩与小工具","scope_status":"required_present_disabled","delivery_state":"planned","contract_refs":["MED-004","MED-005"],"gates":["MD_DOMAIN_VALIDATION"]},

        {"id":"FEAT-P5-001","kind":"feature","phase":"P5","name":"购物与待产包","scope_status":"required_enabled","delivery_state":"planned","contract_refs":["BND-004","SCP-001"]},
        {"id":"FEAT-P5-002","kind":"feature","phase":"P5","name":"产假与 Hospital Pack","scope_status":"required_enabled","delivery_state":"planned","contract_refs":["BND-004","SCP-001"]},
        {"id":"FEAT-P5-003","kind":"feature","phase":"P5","name":"同设备 DadEntry 与主动分享摘要","scope_status":"required_enabled","delivery_state":"planned","contract_refs":["FAM-001","FAM-002","FAM-003"]},

        {"id":"FEAT-P6-001","kind":"feature","phase":"P6","name":"只读、默认关闭、逐字段授权 Widget","scope_status":"required_present_disabled","delivery_state":"planned","contract_refs":["WGT-001","WGT-002","WGT-003","WGT-004"],"gates":["WIDGET_PRIVACY","VISUAL_G4_TOKENS"]},
        {"id":"FEAT-P6-002","kind":"feature","phase":"P6","name":"Pregnancy Summary","scope_status":"required_enabled","delivery_state":"planned","contract_refs":["SCP-001"]},
        {"id":"FEAT-P6-003","kind":"feature","phase":"P6","name":"数据导出、加密 Archive 与跨端迁移","scope_status":"required_enabled","delivery_state":"planned","contract_refs":["ARC-001","ARC-002","ARC-003"]},
        {"id":"FEAT-P6-004","kind":"feature","phase":"P6","name":"Gentle Closure、Quiet Archive 与残留清除","scope_status":"required_present_disabled","delivery_state":"planned","contract_refs":["EPI-003","DEL-002","WGT-004"],"gates":["MD_REVIEW","ETHICS_REVIEW","DELETION_EVIDENCE"]},

        {"id":"SKILL-01","kind":"skill","phase":"P2","name":"PregnancyCore","scope_status":"required_enabled","delivery_state":"planned","contract_refs":["EPI-001","CMD-001"]},
        {"id":"SKILL-02","kind":"skill","phase":"P2","name":"GestationalAge","scope_status":"required_enabled","delivery_state":"planned","contract_refs":["EPI-001","FLD-002"]},
        {"id":"SKILL-03","kind":"skill","phase":"P3","name":"PregnancyProfile","scope_status":"required_enabled","delivery_state":"planned","contract_refs":["EPI-001","DATA-001"]},
        {"id":"SKILL-04","kind":"skill","phase":"P3","name":"PrenatalSchedule","scope_status":"required_enabled","delivery_state":"planned","contract_refs":["MED-005"]},
        {"id":"SKILL-05","kind":"skill","phase":"P3","name":"PrenatalReportParser","scope_status":"required_present_disabled","delivery_state":"planned","contract_refs":["MED-006","FILE-001"],"gates":["MD_REPORT_RULES","PROVIDER_ALLOWLIST"]},
        {"id":"SKILL-06","kind":"skill","phase":"P3","name":"HospitalVisit","scope_status":"required_enabled","delivery_state":"planned","contract_refs":["MED-005"]},
        {"id":"SKILL-07","kind":"skill","phase":"P3","name":"SymptomRecord","scope_status":"required_enabled","delivery_state":"planned","contract_refs":["MED-004","FLD-002"]},
        {"id":"SKILL-08","kind":"skill","phase":"P3","name":"SymptomTriage","scope_status":"required_present_disabled","delivery_state":"planned","contract_refs":["MED-002","MED-003","SAFEOPS-001"],"gates":["MD_SIGNED_RULE_PACK"]},
        {"id":"SKILL-09","kind":"skill","phase":"P4","name":"MedicationRecord","scope_status":"required_enabled","delivery_state":"planned","contract_refs":["MED-007"]},
        {"id":"SKILL-10","kind":"skill","phase":"P4","name":"MedicationSafety","scope_status":"required_present_disabled","delivery_state":"planned","contract_refs":["MED-007","SAFEOPS-001"],"gates":["MD_MEDICATION_RULES"]},
        {"id":"SKILL-11","kind":"skill","phase":"P4","name":"MedicationReminder","scope_status":"required_enabled","delivery_state":"planned","contract_refs":["MED-007"]},
        {"id":"SKILL-12","kind":"skill","phase":"P4","name":"NutritionRecord","scope_status":"required_enabled","delivery_state":"planned","contract_refs":["FLD-001"]},